Product Name, Price, Reviews
Shit the Bed 12/10 Hot Sauce- 8 fl oz,$17.10,192
Cry Baby Craig's Habanero and Garlic Hot Sauce - (3 Pack),$18.99,3
Shit the Bed Black Label 16/10 Hot Sauce- 8 fl oz,$23.75,75
Humble House Ancho and Morita Smokey Sauce | Latin Inspired Tamarind Chile Paste | Natural Vegan &amp; Gluten Free,$14.95,12
Bravado Spice Pineapple and Habanero Hot Sauce,$8.79,54
Rogue Moruga Blood Orange Scorpion Pepper Sauce - 5.4 fl/oz.,$8.19,143
The Bronx Greenmarket Hot Sauce- Green- 5 Oz,$10.75,13
Mad Dog 357 Gold Edition Hot Sauce- 5oz,$18.91,101
El Yucateco Green Hot Sauce Bottle- Chile Habanero- 8 Ounce,$8.91,128
Mad Dog 357 Ghost Pepper Hot Sauce- 5oz,$10.49,233
Hot Avocado SoCal Guac Sauce | A Guacamole Salsa Verde Hot Sauce | Real Avocados- Serrano Chiles and Green Habanero | California Taqueria Style Taco Sauce | 5 FL OZ | by SoCal Hot Sauce | 6/10 heat,$8.99,19
Elijah’s Xtreme Ghost Pepper Hot Sauce- Ultimate Gourmet Hot Pepper Sauce with Extreme Fiery Heat (5 oz),$10.50,162
Dave's Ultimate Insanity Sauce- 5oz. by Unknown,$10.43,77
Marie Sharp's Hot Sauce 6 Pack,$28.29,119
Dave's Gourmet Ghost Pepper Jolokia Hot Sauce- Pack of 1,$9.95,1095
Dawson's Hot Sauce Original- 5 Oz,$16.27,4
Crystal Hot Sauce- 6 oz (Pack of 2),$7.01,28
Valentina Salsa Picante Mexican Hot Sauce - 12.5 oz. (Pack of 3),$12.69,38
Tabasco Original Flavor Pepper Sauce- 2 oz (2 Pack),$6.78,45
Blair's Mega Death Hot Sauce with Liquid Fury and Skull Key Chain- 5 Ounce,$21.42,130
Cholula Original Hot Sauce 12 Oz (Pack of 2),$15.01,103
Wicked Reaper Carolina Hot Sauce,$9.79,80
Nando's Peri Peri Sauce Variety 4 Flavors Combination- 4.7 Ounce (Pack of 4),$16.15,143
The Good Hurt Fuego: Sampler Pack of 7 Different Hot Sauces Inspired by Exotic Flavors and Peppers from Around the World - A Hot Sauce Lover's Gift Set,$34.99,75
El Yucateco 4 Habanero Hot Sauces Gift Pack- 4 Items,$15.96,93
Tear Jerking Spicy and Rebelliously Fiery Rebel Jolokia Ghost Hot Sauce- Scorpion and Reaper 51 Hot Sauces from Aubrey D.,$27.99,1
Aubrey D- Rebel Habanero Fiery Hot Sauce- 5 oz (Case of 12),$75.14,5
